{
  "$schema": "https://json-schema.org/draft/2020-12/schema",
  "title": "ProfileLifecycleLedgerFinding",
  "type": "object",
  "additionalProperties": false,
  "required": ["code", "severity", "message"],
  "properties": {
    "code": {"type": "string"},
    "severity": {"type": "string", "enum": ["high", "medium", "low"]},
    "message": {"type": "string"},
    "path": {"type": ["string", "null"]},
    "suggested_action": {"type": ["string", "null"]}
  }
}
